,headline,subtitle,article_url,image_url,paywall_status,article_type,byline
0," In Trump's polarized America, empathy faces unanimous opposition  ","Once valued in American public life, empathy now faces criticism from the far right, which sees it as a sign of weakness. The left, too, is questioning its relevance: In a world where brutality prevails, can we still afford to show understanding?",https://www.lemonde.fr/en/opinion/article/2026/06/18/in-trump-s-polarized-america-empathy-faces-unanimous-opposition_6754642_23.html,https://img.lemde.fr/2026/06/12/247/0/1772/1181/400/266/75/0/868ced8_upload-1-p8em0b9frupn-idees-usa-empathie-bonhomme-2026.jpg,subscriber only,,
1,"As heatwave hits, French government tries not to appear overwhelmed by climate crisis",,https://www.lemonde.fr/en/environment/article/2026/06/18/as-heatwave-hits-french-government-tries-not-to-appear-overwhelmed-by-climate-crisis_6754628_114.html,https://img.lemde.fr/2026/06/18/274/0/6571/4380/398/265/75/0/e25542a_upload-1-6lgjw7qilzyi-e25542a-upload-1-wp2ukkmpljfe-kew2026011g0617-1013570.jpg,subscriber only,,
2,Ending the war with Iran comes at the cost of major US concessions,,https://www.lemonde.fr/en/international/article/2026/06/18/ending-the-war-with-iran-comes-at-the-cost-of-major-us-concessions_6754629_4.html,https://img.lemde.fr/2026/06/18/0/20/1459/973/398/265/75/0/c2c746f_ftp-1-jisr8krmo6id-5357875-01-06.jpg,subscriber only,,
3,"Paris blocks concert organized by the hard-left, fueling political backlash",The Paris Police Prefect banned on Wednesday a concert organized by France's radical-left party La France Insoumise (LFI) at Place de la République in Paris on Sunday as part of the Fête de la Musique. LFI immediately announced it would challenge the ban in court.,https://www.lemonde.fr/en/politics/article/2026/06/18/paris-blocks-concert-organized-by-the-hard-left-fueling-political-backlash_6754638_5.html,https://img.lemde.fr/2026/06/07/333/0/5000/3333/398/265/75/0/a0235f4_upload-1-sdc4ferecpsd-kzihnioglu-stdenis-pol-melenchon-07062026-46.jpg,subscriber only,,
4,Judicial investigation opened against former French PM Édouard Philippe,"A judicial investigation has been opened against the mayor of Le Havre and one of his deputy mayors on charges including 'misappropriation of public funds,' 'favoritism' and 'conflict of interest,' after a senior civil servant filed a complaint as a plaintiff in the case.",https://www.lemonde.fr/en/france/article/2026/06/18/judicial-investigation-opened-against-former-french-pm-edouard-philippe_6754639_7.html,https://img.lemde.fr/2025/04/10/0/0/3000/2000/398/265/75/0/7991972_sirius-fs-upload-1-sc6fysirrfv1-1744297403208-frame-11.jpg,subscriber only,,
5,Iran emerges in position of strength after ceasefire signed with US,"The memorandum of understanding signed by Washington and Tehran on Wednesday, June 17, puts an end to hostilities and reopens the Strait of Hormuz, but remains vague on the central issue of Iran's nuclear program.",https://www.lemonde.fr/en/opinion/article/2026/06/18/iran-emerges-in-position-of-strength-after-ceasefire-signed-with-us_6754630_23.html,https://img.lemde.fr/2026/06/18/42/0/2800/1866/398/265/75/0/0d88e6b_ftp-1-cd9f13t5xqyl-5357712-01-06.jpg,,Editorial,
6,"'Incidents multiply in the Baltic Sea, where the Russian navy 'now operates in a completely overt manner'","After a Russian frigate fired warning shots at a civilian yacht in the English Channel on June 16, Rear Admiral Johan Norlén, chief of staff of the Swedish navy, describes an increasingly tense climate in Baltic waters.",https://www.lemonde.fr/en/international/article/2026/06/18/incidents-multiply-in-the-baltic-sea-where-the-russian-navy-now-operates-in-a-completely-overt-manner_6754643_4.html,https://img.lemde.fr/2026/06/16/0/0/8256/5504/664/442/75/0/d6c4232_upload-1-0o4vlujgrm2p-000-a9wj7xy.jpg,subscriber only,Conversation, Elise Vincent
7,Jordan Bardella meets with far-right allies in Poland,,https://www.lemonde.fr/en/international/article/2026/06/18/jordan-bardella-meets-with-far-right-allies-in-poland_6754634_4.html,https://img.lemde.fr/2026/06/18/1/0/7064/4709/198/132/95/0/504fa30_ftp-1-61u4azqoqspp-5359114-01-06.jpg,,,
8,"2026 World Cup: Cristiano Ronaldo, Luka Modric and Edin Dzeko, still in the game in their 40s",,https://www.lemonde.fr/en/sports/article/2026/06/18/2026-world-cup-cristiano-ronaldo-luka-modric-and-edin-dzeko-still-in-the-game-in-their-forties_6754609_9.html,https://img.lemde.fr/2026/06/11/0/21/5067/3378/198/132/95/0/ed6a527_upload-1-rurwdi1xsmud-000-b2jl363.jpg,subscriber only,,
9,Macron receives Trump at Château de Versailles to discuss Ukraine,,https://www.lemonde.fr/en/international/article/2026/06/18/macron-receives-trump-at-chateau-de-versailles-to-discuss-ukraine_6754627_4.html,https://img.lemde.fr/2026/06/17/0/0/6000/4000/198/132/95/0/fa3eadb_ftp-1-wezqek2gsh3x-2026-06-17t202140z-460471556-rc2wvlag3jeg-rtrmadp-3-g7-summit-versailles.JPG,subscriber only,,
10,French tanker crosses Strait of Hormuz days after US-Iran deal,,https://www.lemonde.fr/en/international/article/2026/06/18/french-tanker-crosses-strait-of-hormuz-days-after-us-iran-deal_6754631_4.html,https://img.lemde.fr/2026/06/17/0/0/6240/4160/198/132/95/0/fa1cb18_ftp-1-18kiyinegpyd-2026-06-17t191058z-191237262-rc2pvlazdbqz-rtrmadp-3-iran-crisis.JPG,,,
11,Knicks fans flood New York streets for championship parade,,https://www.lemonde.fr/en/sports/article/2026/06/18/knicks-fans-flood-new-york-streets-for-championship-parade_6754641_9.html,,,,
12,Tebnine hospital bears witness to ongoing war in southern Lebanon,,https://www.lemonde.fr/en/international/article/2026/06/18/tebnine-hospital-bears-witness-to-ongoing-war-in-southern-lebanon_6754617_4.html,,subscriber only,,
13,Insee lowers growth forecasts as French households bear brunt of Middle East crisis,,https://www.lemonde.fr/en/economy/article/2026/06/18/insee-lowers-growth-forecasts-as-french-households-bear-brunt-of-middle-east-crisis_6754613_19.html,,subscriber only,,
14,Serbian court jails school shooter's parents after high-profile retrial,,https://www.lemonde.fr/en/international/article/2026/06/18/serbian-court-jails-school-shooter-s-parents-after-high-profile-retrial_6754633_4.html,,,,
15,"On Donbas front, warehouse manager aims to improve daily life for Ukrainian soldiers",,https://www.lemonde.fr/en/international/article/2026/06/18/drones-carrying-hard-boiled-eggs-and-dried-meat-on-the-donbas-front-a-warehouse-manager-aims-to-improve-daily-life-for-ukrainian-soldiers_6754616_4.html,,subscriber only,,
16,France shuts down clandestine Chinese 'police stations' operating on its territory,,https://www.lemonde.fr/en/france/article/2026/06/18/france-shuts-down-clandestine-chinese-police-stations-operating-on-its-territory_6754608_7.html,,subscriber only,,
17,Paris awards honorary citizenship to Palestinian civilians and journalists,,https://www.lemonde.fr/en/france/article/2026/06/18/paris-awards-honorary-citizenship-to-palestinian-civilians-and-journalists_6754640_7.html,,,,
18,"French security replaces Palantir with domestic firm ChapsVision, a complicated choice",,https://www.lemonde.fr/en/france/article/2026/06/17/french-security-replaces-palantir-with-domestic-firm-chapsvision-a-complicated-choice_6754592_7.html,,subscriber only,,
19,From insider trading in France to an American cell phone: How Spain tracked down former prime minister Zapatero,"Judicial cooperation among several countries, including France and Switzerland, has helped uncover an international network relying on 'opaque financial channels,' which were allegedly used, among other things, to pay the former Socialist leader.",https://www.lemonde.fr/en/les-decodeurs/article/2026/06/17/from-insider-trading-in-france-to-an-american-cell-phone-how-spain-tracked-down-former-prime-minister-zapatero_6754603_8.html,https://img.lemde.fr/2026/06/17/0/0/2656/1770/664/442/75/0/61e1c70_ftp-1-ejmstyyxgjrg-3dbd431db2f948f281505c8a122e8f3b-0-8050aa8c56224e4a8b3b3ff6cbacb7f2.jpg,subscriber only,Investigation, Guillaume Daudin
20,The French villages left behind by the long-abandoned hovertrain project,"In the Petite Beauce region, a derelict monorail runs for 18 km through farmland, fueling nostalgia for a bygone era of industrial splendor.",https://www.lemonde.fr/en/politics/article/2026/06/18/the-french-villages-left-behind-by-the-long-abandoned-hovertrain-project_6754618_5.html,https://img.lemde.fr/2026/06/12/86/0/2362/1574/664/442/75/0/552cc8b_upload-1-r9eslce5nz1g-2026-06-08-heg-aerotrain-0254.JPG,subscriber only,Feature, Sylvia Zappi
21,"In China's Qinhuangdao, architect Moshe Safdie's futuristic complex reimagines urban living","The utopian 'Hai Bi Tai,' a 16-story residential complex with 1,800 units, most of which offer views of the sky, the city and the Bohai Sea, still has half its apartments standing empty due to a real estate crisis.",https://www.lemonde.fr/en/culture/article/2026/06/17/in-china-s-qinhuangdao-architect-moshe-safdie-s-futuristic-complex-reimagines-urban-living_6754573_30.html,https://img.lemde.fr/2026/06/04/344/0/8256/5504/664/442/75/0/a9a275f_upload-1-dl2dearbnfcp-64300-sa-qhd-n7.jpeg,subscriber only,Feature, Jordan Pouille
22,Economic and xenophobic: The double threat posed by the Rassemblement National,,https://www.lemonde.fr/en/opinion/article/2026/06/17/economic-and-xenophobic-the-double-threat-posed-by-the-rassemblement-national_6754591_23.html,,,Editorial,Le Monde
23,French government urged to reveal hidden assets of the rich,,https://www.lemonde.fr/en/politics/article/2026/06/17/france-no-longer-knows-who-its-wealthiest-citizens-are-government-urged-to-reopen-black-box-on-the-assets-of-the-richest_6754601_5.html,,subscriber only,News,Denis Cosnard
24,"'In the US, the contradictions in the alliance between the tech world and the MAGA movement can no longer be suppressed'",,https://www.lemonde.fr/en/opinion/article/2026/06/17/in-the-us-the-contradictions-in-the-alliance-between-the-tech-world-and-the-maga-movement-can-no-longer-be-suppressed_6754599_23.html,,subscriber only,Op-Ed,Stephen Holmes
