,headline,subtitle,article_url,image_url,paywall_status,byline,article_type
0," Paris Mayor Grégoire on the climate crisis: 'To adapt together, we need to change our way of life'  ","In an interview with Le Monde, the Socialist leader of the French capital city called individual air conditioning 'a scourge' and urged 'flexibility' and 'makeshift solutions' to respond to the urgent challenge of heat waves.",https://www.lemonde.fr/en/politics/article/2026/06/25/paris-mayor-gregoire-on-the-climate-crisis-to-adapt-together-we-need-to-change-our-way-of-life_6754853_5.html,https://img.lemde.fr/2026/05/27/667/0/5000/3333/400/266/75/0/04b2959_upload-1-ppa7uoxr3rd3-kzihnioglu-paris-pol-canicule-gregoire-emmanuel-27052026-34.jpg,subscriber only,,
1,"France records its hottest day ever, with relief on the horizon",,https://www.lemonde.fr/en/environment/article/2026/06/25/france-records-its-hottest-day-with-relief-on-the-horizon_6754845_114.html,https://img.lemde.fr/2026/06/23/518/0/6212/4141/398/265/75/0/c90947a_upload-1-arufwfykxqm7-kew2026012g0622-1014080.jpg,subscriber only,,
2,"Venezuela declares state of emergency after powerful twin quakes leave at least 32 dead, more than 700 injured",,https://www.lemonde.fr/en/international/article/2026/06/25/two-strong-earthquakes-strike-venezuela-buildings-collapse-in-caracas_6754847_4.html,https://img.lemde.fr/2026/06/25/0/0/6000/4000/398/265/75/0/9aeee6e_ftp-1-vb9blpwn73zg-2c79a3269b614fc3931be9a7a5c55d57-1-b0344a0dd5684c58a9c4203183861a5d.jpg,,,
3,Ukrainian strikes on Russian refineries are triggering shortages and rising discontent,"For the past three months, Kyiv's drones have targeted Russian refineries, ports, depots and pipelines, causing ripple effects throughout the Russian economy. Gasoline has become scarce at service stations.",https://www.lemonde.fr/en/international/article/2026/06/25/ukrainian-strikes-on-russian-refineries-are-triggering-shortages-and-rising-discontent_6754849_4.html,https://img.lemde.fr/2026/06/24/0/102/2571/1714/398/265/75/0/29852a9_upload-1-13imnskz6rwt-capture-d-e-cran-2026-06-24-a-16-24-03.png,subscriber only,,
4,"Two killed in Israeli strike in South Lebanon, Hezbollah denounces ceasefire 'violation'",Two people were killed in southern Lebanon on Wednesday in an Israeli drone strike that Hezbollah said was the latest breach of a ceasefire agreement between the two sides.,https://www.lemonde.fr/en/international/article/2026/06/24/two-killed-in-israeli-strike-in-south-lebanon-hezbollah-denounces-true-violation_6754843_4.html,https://img.lemde.fr/2026/06/18/0/0/5472/3648/398/265/75/0/37d12a0_ftp-1-kzjmn5rapc6q-5365986-01-06.jpg,,,
5,China remains on the sidelines of the World Cup,"The global superpower, which relishes the opportunity to excel at major international events, has only managed to qualify once, in 2002. Despite Xi Jinping's determination, the poor performance of the national football team continues to disappoint Chinese fans.",https://www.lemonde.fr/en/international/article/2026/06/25/china-remains-on-the-sidelines-of-the-world-cup_6754848_4.html,https://img.lemde.fr/2026/06/21/0/0/8379/5586/398/265/75/0/f8d5962_ftp-1-lzjnys2ysrl7-5e7dfa9f97d54aa6aa02319dcb89cc0e-0-bc4636bad55f4f18bb8f991dcf861d07.jpg,subscriber only,,
6,"Masculinism, an increasingly widespread, violent and popular ideology among French youth","According to a report written by the Sénat's delegation for women's rights and published on Wednesday, the movement, which has close ties to the far right, is now considered an emerging terrorist threat and a cause for serious concern.",https://www.lemonde.fr/en/france/article/2026/06/25/masculinism-an-increasingly-widespread-violent-and-popular-ideology-among-french-youth_6754852_7.html,https://img.lemde.fr/2026/06/24/132/0/3667/2444/664/442/75/0/2d9e3cc_upload-1-5slemxuad73p-020-2282976491.jpg,subscriber only, Christophe Ayad and  Solène Cordier,News
7,"By putting a French flag or Eiffel Tower on products, 'Frenchwashing' blurs lines over origin",,https://www.lemonde.fr/en/economy/article/2026/06/25/by-putting-a-french-flag-or-eiffel-tower-on-products-frenchwashing-blurs-lines-over-origin_6754850_19.html,https://img.lemde.fr/2026/05/28/1/0/7647/5098/198/132/95/0/5701b26_ftp-1-tphj3huqp2im-2026-05-28t205634z-460526851-rc2gilarr42m-rtrmadp-3-europe-weather-france-heat.JPG,subscriber only,,
8,ICC judges sue Trump over US sanctions,,https://www.lemonde.fr/en/international/article/2026/06/25/icc-judges-sue-trump-administration-over-us-sanctions_6754846_4.html,https://img.lemde.fr/2026/06/23/71/0/7949/5299/198/132/95/0/afe9ef7_ftp-1-d5eizmabognl-02d7dab0aeb04c4c8ad81fd79acecd03-0-7080896bef354cbaa1eaa686d1d5baf0.jpg,,,
9,'The special tribunal on the aggression against Ukraine could be a major step toward protecting the legal architecture built after World War II',,https://www.lemonde.fr/en/international/article/2026/06/25/the-special-tribunal-on-ukraine-s-aggression-could-be-a-major-step-toward-protecting-the-legal-architecture-built-after-world-war-ii_6754844_4.html,https://img.lemde.fr/2026/06/20/0/0/3874/2583/198/132/95/0/8a2128d_ftp-1-shbnlhxjckp4-2026-06-20t230239z-471794603-rc2txla49r7b-rtrmadp-3-ukraine-crisis-attack-zaporizhzhia.JPG,subscriber only,,
10,250 years of American independence: A groundbreaking Constitution for 'a more perfect union',,https://www.lemonde.fr/en/international/article/2026/06/24/250-years-of-american-independence-a-groundbreaking-constitution-for-a-more-perfect-union_6754840_4.html,https://img.lemde.fr/2026/06/22/0/50/2899/1933/198/132/95/0/5db4293_upload-1-ihyxvqtn8fyy-scene-at-the-signing-of-the-constitution-of-the-united-states.jpg,subscriber only,,
11,New York Mayor Mamdani cements his hold on power after three of his candidates win Democratic primaries,,https://www.lemonde.fr/en/international/article/2026/06/24/new-york-mayor-mamdani-cements-his-hold-on-power-after-three-of-his-candidates-win-democratic-primaries_6754841_4.html,,subscriber only,,
12,Heatwave puts French workers in harsh conditions: 'We have to keep our sleeveless fleece vests on so we're recognizable',,https://www.lemonde.fr/en/economy/article/2026/06/24/heatwave-puts-french-workers-in-harsh-conditions-we-have-to-keep-our-sleeveless-fleece-vests-on-so-we-re-recognizable_6754829_19.html,,subscriber only,,
13,France detects first Ebola case in doctor returning from DRC,,https://www.lemonde.fr/en/france/article/2026/06/24/first-ebola-case-identified-in-france-in-doctor-returning-from-drc_6754828_7.html,,,,
14,"UN commission denounces ongoing 'genocide' in Gaza: 'By targeting children, Israel is attacking the very capacity of the Palestinian people to exist'",,https://www.lemonde.fr/en/international/article/2026/06/24/un-commission-denounces-ongoing-genocide-in-gaza-by-targeting-children-israel-is-attacking-the-very-capacity-of-the-palestinian-people-to-exist_6754835_4.html,,subscriber only,,
15,The unavoidable rise of a less American world,,https://www.lemonde.fr/en/international/article/2026/06/24/the-unavoidable-rise-of-a-less-american-world_6754817_4.html,,subscriber only,,
16,US Congress orders Trump to withdraw troops involved in conflict with Iran,,https://www.lemonde.fr/en/international/article/2026/06/24/us-congress-orders-trump-to-withdraw-troops-involved-in-conflict-with-iran_6754820_4.html,,,,
17,"Heatwave in France spells uncertainty for several EDF nuclear reactors, but RTE says the overall grid is secure",,https://www.lemonde.fr/en/economy/article/2026/06/24/heatwave-in-france-spells-uncertainty-for-several-edf-nuclear-reactors-but-rte-says-the-overall-grid-is-secure_6754812_19.html,,subscriber only,,
18,Resistance fighter Marc Bloch inducted into Panthéon in moving moment of republican solidarity,,https://www.lemonde.fr/en/politics/article/2026/06/24/french-resistance-fighter-marc-bloch-inducted-into-pantheon-in-moving-moment-of-republican-solidarity_6754823_5.html,,subscriber only,,
19,"Living under Paris's zinc roofs in 40°C heat: 'One day, the people living there will look for those responsible'","As France faces extreme heat, many of these top-story spaces have become uninhabitable. Some residents have formed groups to call on their landlords, neighbors and local authorities to address their living conditions.",https://www.lemonde.fr/en/economy/article/2026/06/23/living-under-paris-s-zinc-roofs-in-40-c-heat-one-day-the-people-living-there-will-look-for-those-responsible_6754804_19.html,https://img.lemde.fr/2026/06/23/1643/0/4928/3285/664/442/75/0/f1b1bd0_upload-1-bplzz5kb8c4y-kew2026012g0622-1013930.jpg,subscriber only, Emeline Cazi,Feature
20,Montréal gunman leaves behind manifesto inspired by the 'incel' movement,"A shooting in the Canadian city on Monday, June 22, left three dead, including a police officer and the attacker. In a manifesto, the shooter expressed his hatred of women.",https://www.lemonde.fr/en/international/article/2026/06/23/montreal-gunman-leaves-behind-manifesto-inspired-by-the-incel-movement_6754781_4.html,https://img.lemde.fr/2026/06/22/0/0/8256/5504/664/442/75/0/2074255_ftp-1-wre1cdsz1c1r-5408805-01-06.jpg,subscriber only, Eliott Dumoulin,News
21,France's public pools need urgent renovation: 'What would we do without them? We wouldn't make it',"Aging, energy-intensive and expensive for rural towns to maintain, many aquatic centers in the countryside have been shutting down. Yet these facilities provide equal access for people to cool off and learn to swim. An MP recently sounded the alarm about the worrying situation facing these essential local public services.",https://www.lemonde.fr/en/france/article/2026/06/23/france-s-public-pools-need-urgent-renovation-what-would-we-do-without-them-we-wouldn-t-make-it_6754772_7.html,https://img.lemde.fr/2026/06/18/1/0/4000/2666/664/442/75/0/454f930_upload-1-rdhh1ttuqsbu-mahka-eslami-piscine-municipale-de-cha-teauneuf-sur-sarthe092.jpg,subscriber only, Camille Bordenet,Feature
22,Heeding Resistance fighter Marc Bloch's warning against 'strange defeats',,https://www.lemonde.fr/en/opinion/article/2026/06/24/heeding-resistance-fighter-marc-bloch-s-warning-against-strange-defeats_6754836_23.html,,,Le Monde,Editorial
23,Flagrant unpreparedness to heatwaves highlights urgent need for climate anticipation in France,,https://www.lemonde.fr/en/opinion/article/2026/06/22/flagrant-unpreparedness-to-heatwaves-highlights-urgent-need-for-climate-anticipation-in-france_6754743_23.html,,,Le Monde,Editorial
24,"'Marc Bloch was persecuted not only by the Nazi occupiers, but also by the French state'",,https://www.lemonde.fr/en/opinion/article/2026/06/23/marc-bloch-was-persecuted-not-only-by-the-nazi-occupiers-but-also-by-the-french-state_6754774_23.html,,subscriber only,Anne-Toscane Viudes,Interview
